"Summary: the Momentum 3s sound great and are well built. Fantastic for music, and good enough for calls.

Sound quality: This is the reason to splurge for the Momentum 3s. Great, full-range, tight bass, clear mids and highs. Make sure you've enabled aptX and the maximum bitrate for AAC (search online for instructions on Mac and Android). If you install the Sennheiser app, you can change equalizer settings, like if you want Beats-level bass boost. After playing around, I decided I like the default sound best.

Video: Sounds great. I've experienced no lag with Netflix, YouTube, or Prime Video.

Comfort: Like all over-ear headphones, these can get a little warm. Fine for me. They're also heavier than the all-plastic Bose 700 and Sony XM3, because the Momentum 3s are built with real metal and leather. Weight is similar to the B&W PX7 and B&O H9. I find it ok, and worth it for the sound quality.

Bluetooth: They pair with 2 devices concurrently for audio, and I have them paired with 3 devices in total (MacBook, iPad, and Android phone). Switching works fine.

Controls: They have physical buttons that you learn to find by touch. I find them more reliable and less finicky than touch gestures. (The H9 touch controls didn't work for me at all.) The setting to auto-mute when you remove from your head just didn't work properly for me though. It would mute and unmute if I nodded my head. I turned off the setting, and don't miss it. Not a big deal. The transparency mode is easy to activate with a switch. Some reviewers complain about how you have to fold them to turn them off. I find it no big deal -- it's easy to see that they're folded and off, vs not being sure if the little red light is on.

Build quality: High quality. Solid. Real metal and leather. Downside: they're a little heavier than all-plastic cans like Bose and Sony. I pinched myself with the metal when unfolding them. I can deal.

Case construction: Nice round case, looks high end. It's soft, not hard. It's small enough for my carry on bag and commuter bag. It includes a pocket for a cable in case your battery runs down. Works for me.

Call quality: Sound is great when other people are speaking. At first, I found them pretty awkward for calls, due to the lack of sidetone (hearing your own voice), and would have recommended them only for occasional calls, not if you make lots of video and phone calls. Then I discovered that the app has a setting to give you sidetone! Turn on Transparency mode, and check the box to play music at the same time. Now you can hear the outside world, including your own voice, so you know you're not shouting. Problem solved!

Noise cancellation: Not the main reason why I bought them. This is a bonus feature for me. It helps with public transit and plane noise, and definitely gets the level down enough to make the music or video sound enjoyable. If your #1 goal is noise cancellation, Bose or Sony is probably what you want.

Design: It's subjective. I like the look better than all but the Bang & Olufsen H9s. The white + brown version of the M3s is stylish, though I went with the black.

Conclusion: After extensively researching the options in this price range, and trying multiple headphones, this is the pair I'm keeping. For my personal preferences, these are a winner.",4
"I will compare these to the Bose 700s and Sony XM3s at the end if you’re interested, for now a Momentum 3 review.

DESIGN: These headphones are very sturdy, they feel like a pair of $400 headphones. No squeaking or sliding around. I feel I can safely put these on my backpack without a case and they will be just fine.

APP, BLUETOOTH and EASE OF USE: All you have to do to use the headphones is unfold them and they go into pairing mode, then simply connect to your phone which will ask you to download the Sennheiser app.

Within the app you can change the Noise cancelling between Max, Anti Wind which is just a lower noice cancelling setting, and anti pressure which supposedly reduces the pressure feeling from noice cancelling however I found no difference between max and anti pressure. There is no difference in sound quality either between any of the modes as far as I can tell. You can also turn off noise cancelling altogether and still get the same sound quality.

There is an option called transparent hearing which allows you to hear people’s voices more clearly at the cost of some sound quality, this is useful when walking around the street I suppose.

Lastly there is an Equalizer (EQ) that allows you to adjust the Bass and Trebble which in terms also affects the mids. Its confusing to use and to be honest I prefer the stock setting best.

I haven’t had any issues with the headphones disconnecting, cutting in and out, or not connecting to the app.

NOISE CANCELLING: Noise cancelling is ok, I would say it can block out road noise, and most chatter if you turn the volume up enough. However this will not give you complete silence. Its more of a thing to help you focus on your music.

I ran a small test by putting coffee shop noise on my tv which measured at 85dB. Any louder and you can start to notice the noise. I found it quite surprising that the ANC on these headphones is only a tiny bit better than the one on my Sennheiser 4.50 headphones which are 1/4 the price.

SOUND: This is where these headphones shine. Their sound is crystal clear, the BASS packs a punch which doesn't distort the music or instruments. It doesn't drown out the mids or the vocals. The mids and the highs are also very balanced, it sounds beautiful is the best way I can describe it haha. Some headphones have such bad sound that singing almost becomes a high pitched noise, with the momentums it feels as if someone is singing to you... while musical instruments play along with that voice. With other headphones it just sounds like a bunch of noise clustered together where you cant even tell what instruments are playing and it just sounds like a beat.

MOVIES: The bass from music translates nicely to media. Explosions, car chases, etc all have a punch to them in movies. I can’t think of a better headphone to listen to movies. The momentum 3s enhance your experience as opposed to just letting you listen to what is going on. Also the EQ can be adjusted with as much bass and treble you want and it will save to the headphone itself. So if you connect these via aux to the TV they will keep the EQ.

COMFORT: I left comfort for last because its the biggest downfall at least in my opinion and is the only reason for these headphones getting 4 stars. They are big, bulky, heavy, and you will noice you’re wearing them. These aren’t the headphones you want to walk around with, or take on a flight, or use to study. These headphones are for when you want to enjoy music for 1-2 hours at a time. The metal headband is kind of a pain to adjust, it requires both hands, my hands touching/sliding against the metal bands is kind of concerning as it feels as if Im going to cut myself even though its just a feeling and I doubt its possible. I wish it was covered so It could also have a stealthier look that doesn’t stand out. Simple is better for some. Clamping force is also pretty strong to the point where I have to take them off to rest my ears and my jaw.

Are these worth the $400? Well in my opinion they’re not... why? Because they are uncomfortable. If Im paying $400 for headphones I want to be able to wear them whenever, however long. I want to be able to take them on a walk, to chill in the couch with them, and to use them for movies. It doesn’t matter how good they sound or feel if I can’t wear them for 5+ hours at a time.

Sennheiser Momentum 3 vs Bose 700 vs Sony WF1000XM3

If the sennheiser were more comfortable, and looked like a more normal pair of headphone, i wouldn't even need to write anything here. I would say run out and buy them. However each headphone has their pros and cons.

If you see the term “cabin pressure” it refers to that weird feeling you get when you try ANC Headhones. That underwater feeling.

Bose 700: these have the most neutral sound, they have the least bass out of all three and are also the least loudest. Even with their ANC being almost double the sennheiser I still have to increase the volume to 80% even on a quiet room. They are also the least “fun” to listen too because they sound so flat. However, because of their flat sound signature they sound very accurate and no bass, high, mid is overdone. They are good. In terms of comfort the headphones themselves are comfortable but their ANC gives you that small cabin pressure feeling.

Sony xm3: these have alot of bass but its not the good kind of bass. Its the kind of bass that becomes muffled and distorted. These are by far the least accurate headphones from all 3. Their instrument separation is also bad, there are some instruments you wont even be able to hear with these unless you adjust their eq. However they are more fun to use than the Bose 700s and you will only notice their distortion if you pay close attention. These are also the most comfortable pair of headphones i’ve ever worn. It feels like you’re not even wearing anything. I have worn these for 15 hours at a time. I can fall asleep with them, walk with them, etc. They basically dont exist on my ears. They also have very little to no cabin pressure.

Momentum 3: these sound the best out of the 3. If you take the Sonys “fun” factor and the Boses accuracy you get the mometum 3s. However they’re uncomfortable to wear which is the biggest downfall. The headband has very little padding which becomes bothersome, the ear ups are also super stiff. Their cabin pressure is less than the bose 700s though.

In the end if you’re spending $400 because you want the ultimate headphone for music, movies, and everything sound get the sony xm3. If you want a “stay at home” headphone get the momentum 3s.

If you will only use your headphones for music and you want to use them for long periods of time get the Bose 700s.",5
"When I bought this headphones. Went to compare in Apple Store with Bose 700, and what I can say about this 2 headphones. On Bose better design, battery life, noise cancellation, microphone, but terrible sound quality. On Sennheiser more colorful and strong sound, on Bose sound is very thick and compressed. If for you sound on first place - buy Sennheiser.",5
"Only issues:

Relatively short battery life, as compared to other similar headphones. I haven't really had issues with battery life though -- generally just plug them in after work and they're obviously fully charged the next morning.

Will only charge with included cable... My phone and work computer both charge with usb-c, so I thought it would be convenient to have headphones that also charged with a usb-c cord. Well, these headphones input seem to charge with the included cable. Any wall plug is fine though.

I've had some issues connecting via bluetooth to my work computer (2016 Macbook Pro). Usually this is seamless and doesn't require me to do anything but sometimes I'll have to manually click ""connect"" in the Bluetooth options. Terrible first world problem, I know.

Last dislike: these are pretty expensive, honestly. But you get what you pay for, and I wanted headphones that would last me a long time.

--------

Overall, sound quality is good, noise cancelling is good (don't expect 110% silence though, from these or any other headphones), transparent hearing is actually a really cool feature, and being about to connect to multiple devices fairly seamlessly without an app is really nice.

I picked these over the sony and bose headphones these are often compared against because my priorities were build and sound quality. ANC and battery life were important, but ultimately things that mattered less to me than build/sound quality.

I use these for work and gaming. I work from home, but travel in to the office frequently. These fit my needs really well.",5
"I ordered this set as well as a pair of Beyerdynamic Amion Wireless headphones to compare against each other. After a considerable period of online research and review-reading, I had narrowed my choices down to these two. Honestly, it wasn't even close. The Sennheisers sound far better, fit better, have better BT connectivity and are MUCH cheaper. The Amions, while good, were certainly not good enough to justify the almost $600 price tag. If they were priced at closer to $200, then sure. I will say that I haven't yet had a chance to deal with all of the various and sundry buttons on the Sennheisers, or use them on a phone call (but my main use for these will be at work, so I don't anticipate taking calls while wearing them), so I can't attest to those aspects--and I absolutely refuse to use the noise cancellation, so I am very happy that I can turn it off with a switch, rather than needing a software function through an app, like the Bose QC line. Sound quality is the number one variable for me and using noise cancellation is like trying to listen to music through two bowls of pea soup. Now, as the headline suggests, the sonic quality of these is excellent--especially considering these are BT headphones--but I will say that the overall character of the sound is a wee bit too warm for my taste. It's not mushy--there is good detail and punch--but these were definitely designed to appeal to a more consumer-friendly ear (because consumers have been taught over the past 30 years that tons of bass is more important than overall sound quality). Fortunately, for me, that's not enough of a problem to overcome all of the positives with this product. I plan to use the Sennheiser app just long enough to adjust the EQ on the headset, and then I'm done with it. If Sennheiser wants my data, they can buy it from me, not Hoover it out of my phone for free.",4
"Very happy with my Sennheiser Momentum 3! Next to the Bowers & Wilkins PX7, it's the best sounding headphones I have ever heard! Very close to my PX7 for detail and soundstage! Better audio quality than Sony and Bose! The bass thumps and the highs are so clear! My PX7 and Momentum 3 are my two favorite headphones! I have the Bose 700, Sony WH-1000XM3, Bose QC35II, Bose Soundlink II, and Sony WH-XB900N. Bowers & Wilkins PX7 and Sennheiser Momentum 3 sounds better than all the rest!",5
"I break headphones, usually on the arm just over the cup, despite my best efforts not to (lift off both cups gently at the same time and only as far as I need to remove them). These will not have that problem, while I have concerns about the hinges in the long-term, it's an easier fix with a screwdriver than having to break out the Gorilla Glue.

The battery life averaging 17 hours is a boon as these are not intended for extremely long sessions. The padding on the headband will be giving you a headache by the time you run the battery from full to empty in a session. You can use them as wired headphones as well while charging, which is a feature I've leaned on a few times to save my battery.

The noise cancellation is pretty decent as well, my favorite feature is the Transparent Hearing, you will want to have it set to leave the music playing in the app, this way you can have a conversation with someone without losing all audio from whatever you might be doing, it's also helpful to keep yourself from speaking too loud when using the mic. Speaking of the mic is, it's alright. I'm just told I sound different, but I don't have many audiophile friends that can describe it other than, ""not bad, just different.""

I used the app to drag the EQ a bit up and to the left to get the bit extra bass I like, it's simplified interface is something to get used to, I had a good idea what levels to move where when I find myself working with only a draggable button on a field.

I was considering the Sony XM3s, while some aspects have me thinking the Sony's would be better, the build quality makes up for it, plus genuine leather. Sony may set the hardware standard, but on a flagship product, they couldn't care less if the cups breathe. Gotta keep it all in perspective. Leather.",5
"Pros:

Better call quality. Way better.

Better noise cancelation. It’s not Bose 700 good, but it’s good enough for living next to a busy street in Manhattan.

Neutral

Range isn’t perceptively better than the Momentum 2 for me. If I go my bathroom 15 feet away in my studio apartment it starts cracking. I’m guessing it’s having trouble with the million other 2.4GHz devices nearby.

Cons

It has a USB-C charger but absolutely refuses to charge with any of my USB-C power bricks (Apple and Anker). So much for just taking just my laptop charger with me! Funnily enough, it will work if you use a USB-C to A adapter and back again.

For that reason it charges slowly. The low battery life in class would be fine if it could at least charge quickly.

It has a habit of continuing to play a “leftover tone” at a very low volume after playing some sound. It sounds like a very quiet tinnitus. This with a MacBook Pro.

AAC mode does work with the MacBook Pro, but there’s very high latency. It makes YouTube videos look like poorly lip-synced dubs. This seems to resolve with periodic resetting of Bluetooth from the MBP side.

I don’t know if this is an inherent issue with the codec or a hardware issue, but Sennheiser should just fall back to AptX here. Slightly superior sound quality is not worth how much delay there is. If you’re a competitive gamer, it would be unacceptable.

It seems like a lot of these issues could be resolved. I wouldn’t purchase based on could, though.",3
"I love Sennheiser's sound! I had a pair of HD380 pro headphones from Sennheiser that I loved. My daughter broke them so I used it as an opportunity to switch to a wireless pair. I listened to the Aiwa arc-1, Bose QC 35, Bose 700, Jabra Elite 85, Sennheiser Momentum 2, Sennheiser Momentum 3 and Beats Studio 3 headphones.

They all sound good but the cleanest and most accurate sound AND feeling (yes, your bass should produce a physical sensation) is the Sennheiser Momentum 3.

I originally purchased the Momentum 2 headphones but the ear cups were a little to small for me and it felt like my ear was to close to the speaker.

The Momentum 3 has larger ear cups and more padding. I have had no issues with connectivity and the sound is amazing.

Noise cancellation is ok, which is not the reason I buy headphones at this price.

If you want a great sound that you can tweak even more with their app, I'd recommend the Sennheiser Momentum 3.",5
"I had the previous gen momentums, and was initially pleased with this upgrade. Over time, I found them to be almost useless because they would constantly pause my media. Attempts to turn this off with their broken mobile app failed for weeks, until I was finally able to get them to connect last night. Once I upgraded the firmware to 3.x and turned off the auto-pause feature, these headphones became usable. If you love the sound but hate the functionality, try and get an upgrade installed before sending them back.

I'm leaving this review at 3 stars due to the headache I had to go through to make these not work like cheap garbage.",3
"For listeners who care more about sound quality than isolation, these headphones are a must. I upgraded to these from the Sennheiser HD 380 Pro, and I am very happy with them. The attention to detail in the construction and tuning stand out, while the isolation is more focused on enhancing audio quality than it is supreme isolation from all outside noise. The first test drive with these was on a four hour flight. I wore them straight through and had no ear fatigue or discomfort from excess pressure. The ear cups and head band are very soft and comfortable! The talk-through feature allowed me to hold full conversations with my wife and airline stewards without missing anything. Would recommend for someone who is on the go and cares more about a flat response and punchy bass than someone who wants a higher end noise canceling headphone.",5
"After using these cans, it is hard to go back to any other headphones. The sony xm3's and the bose 700 offer better noise canceling when compared to the Sennheiser's. But no one is going to need such a high level of noise-canceling in regular use unless they are frequent flyers. The sound quality is where the Sennheiser's shine. They have heavy bass without compromising the mids and highs. It makes any kind of music fun and enjoyable. You will never be disappointed with this purchase. People who value sound quality and comfort should definitely have this as their number 1 priority.
The comfort is super amazing. so soft and the real lambskin leather enables me to wear it for prolonged time periods.
They are Sennheiser, you can't go wrong.",5
"Bought these to upgrade from my Sennheiser Momentum 2 headphones that I purchased a few years ago.

YES these are worth the extra $$$ to upgrade.
Observations
Sound quality is significantly improved over the Momentum 2's. Hard to describe but it is richer, the background sounds in the recording come out and FLAC audio plays beautifully on them.
The smart application is a little buggy but not worth taking a point off. having to delete and re-add is a little annoying.
Firmware update process for the headphones was painless however.
Transparent hearing is a nice new feature. Keeps ANC (active noise cancellation) active but mid range sounds (voice) transmits through. Also a plus when singing as your own voice comes through loud and clear.
The EQ is interesting. Jury is still out on full benefits but you can definitely hear differences as you adjust realtime.

Verdict? Indulge your ears and buy them.",5
